{
  "id": "skill-refund-policy-version",
  "name": "Refund policy version verification",
  "description": "Verify current refund policy version before answering refund policy questions.",
  "applies_when": [
    "answering refund policy questions"
  ],
  "does_not_apply_when": [
    "unrelated small talk or translation requests"
  ],
  "instructions": [
    "Look up current refund policy version before responding.",
    "State which refund policy version was applied."
  ],
  "anti_patterns": [
    "Quoting refund terms from memory without checking version."
  ],
  "evidence_trace_ids": [
    "trace-refund-policy-001"
  ],
  "confidence": 0.7,
  "risk_level": "low",
  "scope": "project",
  "version": "0.1.0",
  "status": "active",
  "sensitivity": "internal",
  "owner": "support-team",
  "approved_by": "reviewer",
  "created_at": "2026-05-27T00:00:00+00:00",
  "updated_at": "2026-05-27T00:00:00+00:00",
  "approved_at": "2026-05-27T00:00:00+00:00",
  "expires_at": null,
  "metadata": {}
}
