{
  "anti_patterns": [
    "Approve based only on the pull request title"
  ],
  "applies_when": [
    "Reviewing code changes",
    "Summarizing pull request risk"
  ],
  "approved_at": null,
  "approved_by": null,
  "confidence": 0.87,
  "created_at": "2026-05-26T12:00:00+00:00",
  "description": "Inspect changed files before approving a pull request.",
  "does_not_apply_when": [
    "No repository diff is available"
  ],
  "evidence_trace_ids": [
    "trace-pr-review-001"
  ],
  "expires_at": null,
  "id": "skill-canonical-review",
  "instructions": [
    "Read the changed files before making a recommendation.",
    "Call out missing tests when behavior changes."
  ],
  "metadata": {},
  "name": "Review Diff Before Approval",
  "owner": null,
  "risk_level": "medium",
  "scope": "project",
  "sensitivity": "internal",
  "status": "draft",
  "updated_at": "2026-05-26T12:00:00+00:00",
  "version": "1.2.3"
}