{
  "id": "skill-refund-policy",
  "name": "Refund policy version check",
  "description": "Confirm current refund policy version before answering refund questions.",
  "applies_when": [
    "answering refund questions",
    "customer service refund requests"
  ],
  "does_not_apply_when": [
    "unrelated product questions"
  ],
  "instructions": [
    "Look up current refund policy version before responding.",
    "Escalate when refund timing falls outside current policy version."
  ],
  "anti_patterns": [
    "Quoting refund terms from memory without checking version."
  ],
  "evidence_trace_ids": [
    "trace-chatbot-policy-001"
  ],
  "confidence": 0.7,
  "risk_level": "low",
  "scope": "project",
  "version": "0.1.0",
  "status": "active",
  "sensitivity": "internal",
  "owner": "support-team",
  "approved_by": "reviewer",
  "created_at": "2026-05-27T00:00:00+00:00",
  "updated_at": "2026-05-27T00:00:00+00:00",
  "approved_at": "2026-05-27T00:00:00+00:00",
  "expires_at": null,
  "metadata": {}
}
