{
  "id": "skill-pr-review",
  "name": "Pull request diff-first review discipline",
  "description": "Inspect changed files and diffs of pull requests before drawing review conclusions.",
  "applies_when": [
    "reviewing pull requests",
    "performing code review on changed files"
  ],
  "does_not_apply_when": [
    "purely administrative requests with no code changes"
  ],
  "instructions": [
    "Fetch and inspect changed files and diffs before stating review conclusions.",
    "Confirm code changes include matching test coverage."
  ],
  "anti_patterns": [
    "Approving based only on pull request title or description."
  ],
  "evidence_trace_ids": [
    "trace-gh-pr-review-001"
  ],
  "confidence": 0.62,
  "risk_level": "medium",
  "scope": "project",
  "version": "0.1.0",
  "status": "active",
  "sensitivity": "internal",
  "owner": "platform-team",
  "approved_by": "reviewer",
  "created_at": "2026-05-27T00:00:00+00:00",
  "updated_at": "2026-05-27T00:00:00+00:00",
  "approved_at": "2026-05-27T00:00:00+00:00",
  "expires_at": null,
  "metadata": {}
}
