{
  "id": "skill-pr-review-diff-discipline",
  "name": "Pull request diff-first review discipline",
  "description": "Inspect changed files and diffs of pull requests before drawing review conclusions, and verify test coverage on code changes.",
  "applies_when": [
    "reviewing pull requests",
    "performing code review on changed files",
    "checking pull requests for test coverage"
  ],
  "does_not_apply_when": [
    "purely administrative requests with no code changes"
  ],
  "instructions": [
    "Fetch and inspect changed files and diffs before stating review conclusions.",
    "Confirm that code changes include matching test coverage.",
    "If diffs are unavailable, state that limitation and avoid definitive approval."
  ],
  "anti_patterns": [
    "Approving based only on pull request title or description.",
    "Assuming tests exist without inspecting changed files."
  ],
  "evidence_trace_ids": [
    "trace-pr-review-missing-test-001",
    "trace-pr-review-security-miss-001"
  ],
  "confidence": 0.62,
  "risk_level": "medium",
  "scope": "project",
  "version": "0.1.0",
  "status": "approved",
  "sensitivity": "internal",
  "owner": "platform-team",
  "approved_by": "reviewer",
  "created_at": "2026-05-27T00:00:00+00:00",
  "updated_at": "2026-05-27T00:00:00+00:00",
  "approved_at": "2026-05-27T00:00:00+00:00",
  "expires_at": null,
  "metadata": {}
}
